{
  "$schema": "https://json-schema.org/draft/2020-12/schema",
  "$id": "medioevo.asset_manifest.v0.1",
  "title": "AssetManifest",
  "type": "object",
  "required": ["schema_version", "manifest_id", "assets", "public_safe", "boundary"],
  "properties": {
    "schema_version": { "const": "medioevo.asset_manifest.v0.1" },
    "manifest_id": { "type": "string" },
    "assets": { "type": "array" },
    "public_safe": { "type": "boolean" },
    "boundary": { "type": "object" }
  },
  "additionalProperties": false
}

